{
  "schemaVersion": "1.0",
  "mazeId": "jims-halloween-maze-adventure-005",
  "mazeIndex": 5,
  "exact": true,
  "reachable": 64,
  "reachableFraction": 1.0,
  "loopCount": 3,
  "simplePathCount": 7,
  "deadEndCells": [
    [
      0,
      7
    ],
    [
      1,
      4
    ],
    [
      4,
      6
    ],
    [
      7,
      2
    ]
  ],
  "shortestRouteLength": 24,
  "bestRouteLength": 30,
  "bestCandyTotal": 5,
  "secondBestCandyTotal": 3,
  "uniqueHighestCandy": true,
  "bestRoute": [
    [
      0,
      1
    ],
    [
      0,
      0
    ],
    [
      1,
      0
    ],
    [
      1,
      1
    ],
    [
      2,
      1
    ],
    [
      2,
      0
    ],
    [
      3,
      0
    ],
    [
      4,
      0
    ],
    [
      4,
      1
    ],
    [
      4,
      2
    ],
    [
      4,
      3
    ],
    [
      5,
      3
    ],
    [
      5,
      2
    ],
    [
      5,
      1
    ],
    [
      5,
      0
    ],
    [
      6,
      0
    ],
    [
      6,
      1
    ],
    [
      6,
      2
    ],
    [
      6,
      3
    ],
    [
      7,
      3
    ],
    [
      7,
      4
    ],
    [
      7,
      5
    ],
    [
      6,
      5
    ],
    [
      5,
      5
    ],
    [
      5,
      6
    ],
    [
      6,
      6
    ],
    [
      7,
      6
    ],
    [
      7,
      7
    ],
    [
      6,
      7
    ],
    [
      5,
      7
    ]
  ],
  "temptingRouteCount": 2,
  "routeSummaries": [
    {
      "routeIndex": 2,
      "length": 30,
      "candyTotal": 5,
      "cells": [
        [
          0,
          1
        ],
        [
          0,
          0
        ],
        [
          1,
          0
        ],
        [
          1,
          1
        ],
        [
          2,
          1
        ],
        [
          2,
          0
        ],
        [
          3,
          0
        ],
        [
          4,
          0
        ],
        [
          4,
          1
        ],
        [
          4,
          2
        ],
        [
          4,
          3
        ],
        [
          5,
          3
        ],
        [
          5,
          2
        ],
        [
          5,
          1
        ],
        [
          5,
          0
        ],
        [
          6,
          0
        ],
        [
          6,
          1
        ],
        [
          6,
          2
        ],
        [
          6,
          3
        ],
        [
          7,
          3
        ],
        [
          7,
          4
        ],
        [
          7,
          5
        ],
        [
          6,
          5
        ],
        [
          5,
          5
        ],
        [
          5,
          6
        ],
        [
          6,
          6
        ],
        [
          7,
          6
        ],
        [
          7,
          7
        ],
        [
          6,
          7
        ],
        [
          5,
          7
        ]
      ]
    },
    {
      "routeIndex": 6,
      "length": 30,
      "candyTotal": 3,
      "cells": [
        [
          0,
          1
        ],
        [
          0,
          2
        ],
        [
          1,
          2
        ],
        [
          2,
          2
        ],
        [
          3,
          2
        ],
        [
          3,
          1
        ],
        [
          3,
          0
        ],
        [
          4,
          0
        ],
        [
          4,
          1
        ],
        [
          4,
          2
        ],
        [
          4,
          3
        ],
        [
          5,
          3
        ],
        [
          5,
          2
        ],
        [
          5,
          1
        ],
        [
          5,
          0
        ],
        [
          6,
          0
        ],
        [
          6,
          1
        ],
        [
          6,
          2
        ],
        [
          6,
          3
        ],
        [
          7,
          3
        ],
        [
          7,
          4
        ],
        [
          7,
          5
        ],
        [
          6,
          5
        ],
        [
          5,
          5
        ],
        [
          5,
          6
        ],
        [
          6,
          6
        ],
        [
          7,
          6
        ],
        [
          7,
          7
        ],
        [
          6,
          7
        ],
        [
          5,
          7
        ]
      ]
    },
    {
      "routeIndex": 3,
      "length": 32,
      "candyTotal": 3,
      "cells": [
        [
          0,
          1
        ],
        [
          0,
          2
        ],
        [
          0,
          3
        ],
        [
          1,
          3
        ],
        [
          2,
          3
        ],
        [
          2,
          2
        ],
        [
          3,
          2
        ],
        [
          3,
          1
        ],
        [
          3,
          0
        ],
        [
          4,
          0
        ],
        [
          4,
          1
        ],
        [
          4,
          2
        ],
        [
          4,
          3
        ],
        [
          5,
          3
        ],
        [
          5,
          2
        ],
        [
          5,
          1
        ],
        [
          5,
          0
        ],
        [
          6,
          0
        ],
        [
          6,
          1
        ],
        [
          6,
          2
        ],
        [
          6,
          3
        ],
        [
          7,
          3
        ],
        [
          7,
          4
        ],
        [
          7,
          5
        ],
        [
          6,
          5
        ],
        [
          5,
          5
        ],
        [
          5,
          6
        ],
        [
          6,
          6
        ],
        [
          7,
          6
        ],
        [
          7,
          7
        ],
        [
          6,
          7
        ],
        [
          5,
          7
        ]
      ]
    },
    {
      "routeIndex": 1,
      "length": 30,
      "candyTotal": 2,
      "cells": [
        [
          0,
          1
        ],
        [
          0,
          0
        ],
        [
          1,
          0
        ],
        [
          1,
          1
        ],
        [
          2,
          1
        ],
        [
          2,
          0
        ],
        [
          3,
          0
        ],
        [
          3,
          1
        ],
        [
          3,
          2
        ],
        [
          2,
          2
        ],
        [
          2,
          3
        ],
        [
          3,
          3
        ],
        [
          3,
          4
        ],
        [
          2,
          4
        ],
        [
          2,
          5
        ],
        [
          3,
          5
        ],
        [
          4,
          5
        ],
        [
          4,
          4
        ],
        [
          5,
          4
        ],
        [
          6,
          4
        ],
        [
          7,
          4
        ],
        [
          7,
          5
        ],
        [
          6,
          5
        ],
        [
          5,
          5
        ],
        [
          5,
          6
        ],
        [
          6,
          6
        ],
        [
          7,
          6
        ],
        [
          7,
          7
        ],
        [
          6,
          7
        ],
        [
          5,
          7
        ]
      ]
    },
    {
      "routeIndex": 0,
      "length": 34,
      "candyTotal": 2,
      "cells": [
        [
          0,
          1
        ],
        [
          0,
          0
        ],
        [
          1,
          0
        ],
        [
          1,
          1
        ],
        [
          2,
          1
        ],
        [
          2,
          0
        ],
        [
          3,
          0
        ],
        [
          3,
          1
        ],
        [
          3,
          2
        ],
        [
          2,
          2
        ],
        [
          1,
          2
        ],
        [
          0,
          2
        ],
        [
          0,
          3
        ],
        [
          1,
          3
        ],
        [
          2,
          3
        ],
        [
          3,
          3
        ],
        [
          3,
          4
        ],
        [
          2,
          4
        ],
        [
          2,
          5
        ],
        [
          3,
          5
        ],
        [
          4,
          5
        ],
        [
          4,
          4
        ],
        [
          5,
          4
        ],
        [
          6,
          4
        ],
        [
          7,
          4
        ],
        [
          7,
          5
        ],
        [
          6,
          5
        ],
        [
          5,
          5
        ],
        [
          5,
          6
        ],
        [
          6,
          6
        ],
        [
          7,
          6
        ],
        [
          7,
          7
        ],
        [
          6,
          7
        ],
        [
          5,
          7
        ]
      ]
    },
    {
      "routeIndex": 4,
      "length": 24,
      "candyTotal": 0
    },
    {
      "routeIndex": 5,
      "length": 24,
      "candyTotal": 0
    }
  ],
  "validation": {
    "passed": true,
    "errors": [],
    "warnings": [],
    "constraints": {
      "C1_uniqueMaxScore": true,
      "C2_scoreMargin": true,
      "C3_bestIsNotShortest": true,
      "C4_bestOverShortest": true,
      "C5_temptingRoutes": true,
      "C6_candyCount": true,
      "C7_candyNotInDeadEndOrTerminal": true,
      "C8_candySpacing": true,
      "E1_bestRouteEdgeHugging": true,
      "E2_reachableFraction": true,
      "G1_exactEnumeration": true,
      "G2_startReachesFinish": true,
      "G3_loopCount": true,
      "G4_deadEndCount": true,
      "G5_deadEndDepth": true,
      "G6_simpleRouteCount": true
    }
  }
}
